number,value,datetime_start,datetime_complete,duration,params_activation,params_batch_size,params_dropout_p,params_hidden_size_0,params_hidden_size_1,params_hidden_size_2,params_lr,params_weight_decay,state
0,4177.92724609375,2025-01-11 22:22:05.472221,2025-01-11 22:41:12.767257,0 days 00:19:07.295036,elu,64,0.35403628889802274,58,123,98,0.00011527987128232407,1.152644954031562e-05,COMPLETE
1,258.4601745605469,2025-01-11 22:41:12.768141,2025-01-11 22:45:47.866088,0 days 00:04:35.097947,leaky_relu,64,0.18318092164684585,36,36,50,0.0023345864076016252,0.0003725393839578887,COMPLETE
2,232.38038635253906,2025-01-11 22:45:47.866925,2025-01-11 22:47:19.117291,0 days 00:01:31.250366,leaky_relu,64,0.048836057003191935,82,21,84,0.01129013355909268,0.00029914693021302176,COMPLETE
3,199.66543579101562,2025-01-11 22:47:19.118110,2025-01-11 22:49:09.059814,0 days 00:01:49.941704,selu,64,0.3875664116805573,19,118,45,0.06584106160121614,0.04067908494359546,COMPLETE
4,4655.91259765625,2025-01-11 22:49:09.060642,2025-01-11 23:08:22.536605,0 days 00:19:13.475963,leaky_relu,64,0.27134804157912423,25,38,21,0.00026471141828218194,0.08598737339212278,COMPLETE
5,210.72494506835938,2025-01-11 23:08:22.538023,2025-01-11 23:09:50.168375,0 days 00:01:27.630352,relu,64,0.05793452976256486,103,38,16,0.038842777547031436,2.078699690689779e-06,COMPLETE
6,195.4523162841797,2025-01-11 23:09:50.169219,2025-01-11 23:11:07.297293,0 days 00:01:17.128074,sigmoid,128,0.2806385987847481,51,52,98,0.020554245520150755,0.00013731092468240313,COMPLETE
7,1878.931884765625,2025-01-11 23:11:07.298309,2025-01-11 23:41:08.512175,0 days 00:30:01.213866,leaky_relu,128,0.37777556927152434,18,28,19,0.000485729517921717,6.398916399944082e-06,COMPLETE
8,331.5430603027344,2025-01-11 23:41:08.513413,2025-01-11 23:56:27.880649,0 days 00:15:19.367236,leaky_relu,128,0.4480456499617466,121,107,87,0.0008995191735587172,0.00013662775841358918,COMPLETE
9,217.81141662597656,2025-01-11 23:56:27.881374,2025-01-12 00:06:08.346406,0 days 00:09:40.465032,selu,64,0.16160146601037761,108,113,16,0.003600575029200904,0.07226207258080496,COMPLETE
10,239.19163513183594,2025-01-12 00:06:08.347374,2025-01-12 00:08:39.835116,0 days 00:02:31.487742,sigmoid,128,0.4787668343984489,55,69,125,0.015834160151554533,0.0033770935828820515,COMPLETE
11,220.8907012939453,2025-01-12 00:08:39.835913,2025-01-12 00:10:54.530966,0 days 00:02:14.695053,sigmoid,128,0.321218625773408,42,75,57,0.09649215059537981,0.0059324358248924085,COMPLETE
12,231.92684936523438,2025-01-12 00:10:54.531867,2025-01-12 00:16:27.763572,0 days 00:05:33.231705,selu,128,0.40490277707431066,76,66,116,0.09945331623481247,5.8476408545009116e-05,COMPLETE
13,222.71389770507812,2025-01-12 00:16:27.765161,2025-01-12 00:20:40.722362,0 days 00:04:12.957201,tanh,128,0.29466880516904065,55,86,47,0.02690555670936806,0.0015927936006899402,COMPLETE
14,584.1461791992188,2025-01-12 00:20:40.723204,2025-01-12 00:23:29.611525,0 days 00:02:48.888321,selu,128,0.49105531884414805,35,54,71,0.011647647095599479,0.01534328644370788,COMPLETE
15,224.9007568359375,2025-01-12 00:23:29.612718,2025-01-12 00:27:15.525072,0 days 00:03:45.912354,sigmoid,64,0.23300171112013063,66,93,107,0.03863936210521333,4.776742142184159e-05,COMPLETE
16,351.28338623046875,2025-01-12 00:27:15.526052,2025-01-12 00:35:55.806977,0 days 00:08:40.280925,tanh,64,0.41321739967986504,17,55,38,0.005591555587645788,0.0007216467036937894,COMPLETE
17,116.43949127197266,2025-01-12 00:35:55.807760,2025-01-12 00:38:05.040855,0 days 00:02:09.233095,relu,128,0.3378241526481411,44,96,69,0.05214404749999792,0.018580991563685745,COMPLETE
18,113.23255920410156,2025-01-12 00:38:05.041624,2025-01-12 00:40:40.188484,0 days 00:02:35.146860,relu,128,0.32550441629442534,91,94,72,0.021788520403762474,0.01092187013654958,COMPLETE
19,318.34173583984375,2025-01-12 00:40:40.189253,2025-01-12 00:44:42.920165,0 days 00:04:02.730912,relu,128,0.33232219347990366,84,96,68,0.007662888782748649,0.011985307654447096,COMPLETE
20,191.2002716064453,2025-01-12 00:44:42.920884,2025-01-12 00:49:54.106178,0 days 00:05:11.185294,relu,128,0.3380549877235325,92,102,62,0.04224686475460745,0.025679970910060385,COMPLETE
21,285.5688171386719,2025-01-12 00:49:54.107096,2025-01-12 00:52:51.868154,0 days 00:02:57.761058,relu,128,0.3321841602882902,95,103,64,0.04756353402559772,0.021123454921855342,COMPLETE
22,119.20243072509766,2025-01-12 00:52:51.868937,2025-01-12 00:55:02.691799,0 days 00:02:10.822862,relu,128,0.36595847139144033,93,84,79,0.02615929903714794,0.007320304261334594,COMPLETE
23,303.0641784667969,2025-01-12 00:55:02.692574,2025-01-12 00:58:37.050729,0 days 00:03:34.358155,relu,128,0.43124044959028535,118,79,81,0.0185066547418024,0.005378804899095651,COMPLETE
24,213.3441162109375,2025-01-12 00:58:37.052039,2025-01-12 01:01:18.146560,0 days 00:02:41.094521,relu,128,0.3840141745440193,104,86,80,0.02531453063303104,0.0020779217834073827,COMPLETE
25,248.75526428222656,2025-01-12 01:01:18.147340,2025-01-12 01:04:26.724459,0 days 00:03:08.577119,relu,128,0.36112803418735223,68,87,91,0.0606845074688628,0.007026928876418913,COMPLETE
26,232.36611938476562,2025-01-12 01:04:26.725752,2025-01-12 01:07:00.598274,0 days 00:02:33.872522,elu,128,0.4416860695555194,92,95,77,0.030196784805749586,0.037364443453792105,COMPLETE
27,197.6277618408203,2025-01-12 01:07:00.599131,2025-01-12 01:10:18.315591,0 days 00:03:17.716460,relu,128,0.3019641312287988,113,64,56,0.01438561954490445,0.013388093565416481,COMPLETE
28,287.6747131347656,2025-01-12 01:10:18.316776,2025-01-12 01:15:49.678471,0 days 00:05:31.361695,relu,128,0.36549992821367433,79,81,74,0.007973111764916675,0.0023244693595088155,COMPLETE
29,164.36814880371094,2025-01-12 01:15:49.679562,2025-01-12 01:20:54.616641,0 days 00:05:04.937079,elu,128,0.25009499424968407,98,127,100,0.064035044112306,0.009424805258569905,COMPLETE
30,237.9355926513672,2025-01-12 01:20:54.617415,2025-01-12 01:25:36.854951,0 days 00:04:42.237536,relu,128,0.34954622641559097,126,114,33,0.018914005433141014,0.050505911996913386,COMPLETE
31,154.8308563232422,2025-01-12 01:25:36.856245,2025-01-12 01:30:08.981855,0 days 00:04:32.125610,elu,128,0.23781581673782975,96,127,98,0.062205253331777406,0.008291331554972022,COMPLETE
32,224.8660430908203,2025-01-12 01:30:08.983220,2025-01-12 01:34:17.027858,0 days 00:04:08.044638,elu,128,0.306735288773235,89,120,93,0.028951938385113025,0.026630567673651795,COMPLETE
33,187.34315490722656,2025-01-12 01:34:17.028931,2025-01-12 01:39:14.308187,0 days 00:04:57.279256,elu,128,0.24333667656441285,64,108,102,0.0664167539884012,0.005096226558118074,COMPLETE
34,222.85581970214844,2025-01-12 01:39:14.308951,2025-01-12 01:41:57.487904,0 days 00:02:43.178953,elu,128,0.19881885807089056,86,126,109,0.03473653230203155,0.0012602177213683694,COMPLETE
35,167.33010864257812,2025-01-12 01:41:57.488716,2025-01-12 01:44:43.886704,0 days 00:02:46.397988,tanh,128,0.27251781825943017,75,97,86,0.011452181939095467,0.0033707205411416057,COMPLETE
36,267.3580017089844,2025-01-12 01:44:43.887491,2025-01-12 01:47:24.360341,0 days 00:02:40.472850,relu,128,0.3603310145348152,99,88,91,0.05163557623080494,0.07286364545367618,COMPLETE
37,236.1190948486328,2025-01-12 01:47:24.361152,2025-01-12 01:50:14.356884,0 days 00:02:49.995732,elu,64,0.3071918331289083,109,73,66,0.08043432687759242,0.01132850312345216,COMPLETE
38,246.98207092285156,2025-01-12 01:50:14.357822,2025-01-12 01:52:39.054529,0 days 00:02:24.696707,relu,128,0.3992662740288402,46,115,58,0.048046238222722464,0.031051078403812417,COMPLETE
39,170.38064575195312,2025-01-12 01:52:39.055498,2025-01-12 01:55:23.266013,0 days 00:02:44.210515,relu,128,0.2777875271537328,83,60,75,0.02366950675285511,0.09962060286703818,COMPLETE
40,246.2303009033203,2025-01-12 01:55:23.266814,2025-01-12 01:59:50.862682,0 days 00:04:27.595868,leaky_relu,64,0.3858342616904167,30,47,84,0.07454935795073898,0.0008032589053750013,COMPLETE
41,236.40562438964844,2025-01-12 01:59:50.863795,2025-01-12 02:02:08.119347,0 days 00:02:17.255552,elu,128,0.25500248632347144,96,127,97,0.060028799063277405,0.008676435401021781,COMPLETE
42,234.08348083496094,2025-01-12 02:02:08.120183,2025-01-12 02:05:59.436352,0 days 00:03:51.316169,elu,128,0.2152414246147294,102,120,114,0.044723430177318835,0.018984700706260144,COMPLETE
43,159.8803253173828,2025-01-12 02:05:59.437098,2025-01-12 02:12:13.486278,0 days 00:06:14.049180,elu,128,0.1774445453954283,113,109,101,0.09965817451689563,0.009157077255137671,COMPLETE
44,232.2859344482422,2025-01-12 02:12:13.487535,2025-01-12 02:15:44.435561,0 days 00:03:30.948026,elu,128,0.16089368458691558,113,108,124,0.09295339499085306,0.003889479925630901,COMPLETE
45,179.68186950683594,2025-01-12 02:15:44.436571,2025-01-12 02:18:08.546609,0 days 00:02:24.110038,leaky_relu,128,0.17823982350924228,108,102,70,0.033469169549800885,0.043052537502523795,COMPLETE
46,204.3544158935547,2025-01-12 02:18:08.547624,2025-01-12 02:21:37.643077,0 days 00:03:29.095453,selu,128,0.11603191145683803,119,79,107,0.08080826559394332,0.007380990750363855,COMPLETE
47,216.59951782226562,2025-01-12 02:21:37.643967,2025-01-12 02:26:11.438292,0 days 00:04:33.794325,sigmoid,128,0.31528369963432823,127,90,51,0.02236779962508415,0.018422545691055142,COMPLETE
48,191.99778747558594,2025-01-12 02:26:11.439307,2025-01-12 02:29:31.939666,0 days 00:03:20.500359,tanh,64,0.29265594570254805,71,112,118,0.0363044695525071,0.003151280729075082,COMPLETE
49,138.5594024658203,2025-01-12 02:29:31.940669,2025-01-12 02:32:15.868760,0 days 00:02:43.928091,elu,128,0.26272688721177023,88,99,80,0.09559751575859629,0.05385056099604305,COMPLETE
